<?xml version="1.0" encoding="UTF-8"?>
<!DOCTYPE PLANIMETRY SYSTEM "../xml/planimetry.dtd" >
<PLANIMETRY>
  <HOME name="sweet_home" width="100" height="100">
    <ROOM name="corridor" width="50" height="10" x="0" y="60"/>
    <ROOM name="studio" width="25" height="60" x="0" y="0"/>
    <ROOM name="bedroom1" width="40" height="30" x="0" y="70"/>
    <ROOM name="bedroom2" width="25" height="60" x="25" y="20"/>
    <ROOM name="bedroom3" width="25" height="60" x="50" y="0"/>
    <ROOM name="bathroom" width="10" height="30" x="40" y="70"/>
    <ROOM name="kitchen" width="25" height="60" x="75" y="0"/>
    <ROOM name="lounge" width="50" height="40" x="50" y="60"/>
    
    <WALL width="0" height="60" x="25" y="0"/>
    <WALL width="0" height="60" x="50" y="0"/>
    <WALL width="0" height="60" x="75" y="0"/>
    <WALL width="0" height="30" x="40" y="70"/>
    <WALL width="0" height="30" x="50" y="70"/>
    
    <WALL width="10" height="0" x="0" y="60"/>
    <WALL width="20" height="0" x="15" y="60"/>
    <WALL width="20" height="0" x="40" y="60"/>
    <WALL width="20" height="0" x="65" y="60"/>
    <WALL width="10" height="0" x="90" y="60"/>
    <WALL width="10" height="0" x="0" y="70"/>
    <WALL width="25" height="0" x="15" y="70"/>
    <WALL width="5" height="0" x="45" y="70"/>    
    
    <DOOR width="5" height="0" x="10" y="60"/>  
    <DOOR width="5" height="0" x="35" y="60"/>  
    <DOOR width="5" height="0" x="60" y="60"/> 
    <DOOR width="5" height="0" x="85" y="60"/> 
    <DOOR width="5" height="0" x="10" y="70"/> 
    <DOOR width="5" height="0" x="40" y="70"/> 
    
  </HOME>
</PLANIMETRY>
