<?xml version="1.0" encoding="UTF-8"?>
<!DOCTYPE PLANIMETRY SYSTEM "../src/robomap/xml/planimetry.dtd" >

<PLANIMETRY>
    
  	<HOME name="sweet_home" width="10" height="10" startx="0" starty="0">
      
    	<ROOM name="room1" x="0" y="0" width="5" height="5">
    		<OBJECT name="table1" x="1" y="2" width="2" height="2" orientation="RIGHT" />
    	</ROOM>
    	
    	<ROOM name="room2" x="5" y="0" width="5" height="5">
        	<OBJECT name="table2" x="6" y="2" width="2" height="2" orientation="RIGHT" />
    	</ROOM>
    	
    	<ROOM name="room3" x="0" y="5" width="5" height="5">
        	<OBJECT name="table3" x="2" y="7" width="1" height="1" orientation="RIGHT" />
    	</ROOM>
    	
    	<ROOM name="room4" x="5" y="5" width="2" height="5"/>
    	
    	<ROOM name="room5" x="7" y="5" width="3" height="5">
        	<OBJECT name="table5" x="7" y="7" width="1" height="2" orientation="RIGHT" />
    	</ROOM>
    
    	<WALL x="0" y="5" orientation="RIGHT" lenght="2"/>
    	<WALL x="3" y="5" orientation="RIGHT" lenght="3"/>
    	<WALL x="7" y="5" orientation="RIGHT" lenght="1"/>
    	<WALL x="9" y="5" orientation="RIGHT" lenght="1"/>
    	<WALL x="5" y="0" orientation="FORWARD" lenght="1"/>
    	<WALL x="5" y="2" orientation="FORWARD" lenght="4"/>
    	<WALL x="5" y="7" orientation="FORWARD" lenght="3"/> 
    	<WALL x="7" y="5" orientation="FORWARD" lenght="1"/>   
    	<WALL x="7" y="7" orientation="FORWARD" lenght="3"/>   
    
    	<DOOR x="2" y="5" orientation="RIGHT" lenght="1" />  
    	<DOOR x="6" y="5" orientation="RIGHT" lenght="1" />  
    	<DOOR x="8" y="5" orientation="RIGHT" lenght="1"/>  
    	<DOOR x="5" y="1" orientation="FORWARD" lenght="1"/>  
    	<DOOR x="5" y="6" orientation="FORWARD" lenght="1"/>
    	<DOOR x="7" y="6" orientation="FORWARD" lenght="1"/>
    
  	</HOME>
  
</PLANIMETRY>
