<?xml version="1.0" encoding="UTF-8"?>
<!DOCTYPE PLANIMETRY SYSTEM "../src/robomap/xml/planimetry.dtd" >

<PLANIMETRY>
    
  	<HOME name="basili_home" width="19" height="11" startx="1" starty="0">
      
    	<ROOM name="ingresso" x="0" y="0" width="4" height="7">
    		<OBJECT name="cappelliera" x="0" y="0" width="1" height="1" orientation="RIGHT"/>
    		<OBJECT name="attaccapanni" x="3" y="3" width="1" height="2" orientation="LEFT"/>
    	</ROOM>
    	
    	<ROOM name="camera_da_letto_1" x="0" y="7" width="5" height="4">
    	    <OBJECT name="letto_matrimoniale" x="0" y="8" width="2" height="2" orientation="RIGHT"/>
        	<OBJECT name="comodino" x="0" y="7" width="1" height="1" orientation="RIGHT"/>        	
        	<OBJECT name="comodino" x="0" y="10" width="1" height="1" orientation="RIGHT"/>
        	<OBJECT name="armadio" x="4" y="7" width="1" height="4" orientation="LEFT"/>
    	</ROOM>
    	
    	<ROOM name="corridoio_1" x="5" y="5" width="6" height="3"/>
    	
    	<ROOM name="bagno" x="5" y="8" width="6" height="3">        	
        	<OBJECT name="bidet" x="5" y="10" width="1" height="1" orientation="BACKWARD"/>
        	<OBJECT name="water" x="7" y="10" width="1" height="1" orientation="BACKWARD"/>
        	<OBJECT name="lavandino" x="6" y="8" width="1" height="1" orientation="FORWARD"/>
        	<OBJECT name="doccia" x="9" y="9" width="2" height="2" orientation="LEFT"/>
    	</ROOM>
    	
    	<ROOM name="salotto" x="11" y="5" width="8" height="6">
        	<OBJECT name="televisione" x="11" y="8" width="1" height="2" orientation="RIGHT" status="OFF">
        	    <INTERACTION name="SWITCH_ON"/>
        	    <INTERACTION name="SWITCH_OFF"/>
        	</OBJECT>
        	<OBJECT name="divano" x="14" y="8" width="1" height="2" orientation="LEFT">
        	    <INTERACTION name="CLEAN"/>
        	</OBJECT>
        	<OBJECT name="tavolo" x="17" y="9" width="1" height="1" orientation="LEFT"/>
    	</ROOM>
    	
    	<ROOM name="cucina" x="13" y="0" width="6" height="5">
    	    <OBJECT name="frigo" x="18" y="3" width="1" height="2" orientation="LEFT" status="ON">
    	        <INTERACTION name="SWITCH_ON"/>
        	    <INTERACTION name="SWITCH_OFF"/>
    	    </OBJECT>
        	<OBJECT name="lavello" x="13" y="0" width="6" height="1" orientation="FORWARD"/>
        	<OBJECT name="cestino" x="13" y="4" width="1" height="1" orientation="RIGHT"/>        	
    	</ROOM>
    	
    	<ROOM name="corridoio_2" x="4" y="0" width="9" height="2"/>
    	
    	<ROOM name="ripostiglio" x="9" y="2" width="4" height="3"/>
    	
    	<ROOM name="camera_da_letto_2" x="4" y="2" width="5" height="3">
        	<OBJECT name="letto" x="4" y="3" width="2" height="1" orientation="RIGHT"/>
        	<OBJECT name="comodino" x="4" y="4" width="1" height="1" orientation="RIGHT"/>
        	<OBJECT name="cassettiera" x="8" y="4" width="1" height="1" orientation="BACKWARD"/>
    	</ROOM>    	
    
    	<WALL x="0" y="7" orientation="RIGHT" lenght="3"/>
    	<WALL x="4" y="2" orientation="RIGHT" lenght="3"/>
    	<WALL x="4" y="5" orientation="RIGHT" lenght="9"/>
    	<WALL x="4" y="7" orientation="RIGHT" lenght="1"/>
    	<WALL x="5" y="8" orientation="RIGHT" lenght="3"/>
    	<WALL x="8" y="2" orientation="RIGHT" lenght="3"/>
    	<WALL x="9" y="8" orientation="RIGHT" lenght="2"/>
    	<WALL x="12" y="2" orientation="RIGHT" lenght="1"/>    	
    	
    	<WALL x="4" y="1" orientation="FORWARD" lenght="4"/>
    	<WALL x="5" y="7" orientation="FORWARD" lenght="4"/> 
    	<WALL x="9" y="2" orientation="FORWARD" lenght="3"/>   
    	<WALL x="11" y="8" orientation="FORWARD" lenght="3"/>   
    	<WALL x="13" y="0" orientation="FORWARD" lenght="5"/>
    
    	<DOOR x="3" y="7" orientation="RIGHT" lenght="1" />  
    	<DOOR x="7" y="2" orientation="RIGHT" lenght="1" />  
    	<DOOR x="8" y="8" orientation="RIGHT" lenght="1"/>  
    	<DOOR x="11" y="2" orientation="RIGHT" lenght="1"/>  
    	
    	<DOOR x="4" y="0" orientation="FORWARD" lenght="1"/>  
    
  	</HOME>
  
</PLANIMETRY>
